benchmark/extraction_prompts_v3/timing-along-the-cardiac-cycle-modulates-neural-si.extracted.json

{
  "statistical_sentences": [
    "This is indeed what we found (Fig. 3c, blue: intermediate categories, grey: categories used for discrimination) confirming the linear relationship between the CRS-absolute PE component and its model-based counterpart (test on the left-out data: t31 =-7.3027; p=3.22e-8) and also the generalisability and robustness of our machine learning approach.",
    "Naturally, as the diastole phase is longer on average than the systole phase, we expect a higher number of outcomes presented during the diastole phase (m=65\u00b15 and 54\u00b15 for diastole and systole, respectively).",
    "For example, the frequency of occurrence of both conditions was similar in the different learning blocks (e.g. predictive or non-predictive) employed in the task (see Methods; systole F3=0.2, p=0.893; diastole F3=0.2, p=0.896, supplementary Fig.3a) and were associated with similar levels of overall reward received in the task (t31=0.8046, p=0.4272, supplementary Fig.3b), unsigned PEs from the RL model (t31=-0.0581, p=0.9541, Supplementary Fig 3c) or signed PE (t31= -0.72, p= 0.4769).Having split the outcomes according to the cardiac cycle, we found that the associated absolute PE-related CRS depended on whether the outcome was presented at systole or diastole, with the mean CRS magnitude related to absolute PE being more negative when outcomes were presented at the diastole compared to the systole phase (t31=2.8460, p=0.0078, fig4b).",
    "Additionally, beyond the linear relationship between absolute PE and CRS (fig3c), we found that the effect of the cardiac cycle increased as absolute PEs became smaller (main effect of absolute PE: t252=14.055, p=1.6e-33; heart cycle: t252=-2.154, p=0.0321; see fig4e).",
    "This effect was mainly driven by the fact that near-threshold absolute PE were more strongly represented at diastole (t31=2.4089, p=0.0221, fig4c).",
    "In line with our predictions, we found that participants showing a higher difference in CRS between diastole and systole were the participants that had higher learning rates and better task performance as indexed by the total number of rewards received (learning rates: t30=2.1821, p=0.0371; reward: t30=2.4329, p=0.0212; Fig.4f and 4g).",
    "The relationship was only present in the blocks in which learning was possible (predictive blocks: learning rates: t30=2.4468, p=0.0205; reward: t30=2.3751, p=0.0241 Fig.4g and 4j; non-predictive blocks: learning rates: t30=-0.4445, p=0.6598; reward: t30=1.1354, p=0.2652 Fig.4h and 4k).",
    "MethodsParticipantsThirty-five healthy, right-handed adults participated in the experiment. 3 participants were excluded due to excessive noise in the EEG signal so that data from 32 participants were included in the analyses (24 \u00b1 7.13; 10; 0.83 \u00b1 0.13; where numbers correspond to mean age \u00b1 SD; number of female participants, handiness mean \u00b1 SD; as measured by the Edinburgh handedness inventory 21).",
    "For example, if the house predicted orange deterministically (100%), the face predicted blue and they were presented together, then there was a 50/50% chance of getting a blue/orange.",
    "If, however, the face was presented twice, then the outcome was blue, 100% of the time.",
    "PV is then converted to a choice probability following the equation: p = 1/(1 + e(\u03b2 * (PV \u2013 0.5) + \u03b3 * Cn\u22121)), where \u03b2 is the inverse temperature, or exploration parameter and \u03b3 represents the choice stickiness49,50 (the degree to which choices are likely to simply be repeated from trial to trial regardless of outcome).",
    "Locked to the heartbeat, these binary groups included: (1) positive versus negative signed PEs, (2) very high and very low absolute PEs.All analyses were performed on windows with a length of N=60 ms and the window centre \u03c4 was shifted from \u2212100 to 600 ms relative to the heartbeat onset, in 10-ms increments.",
    "We repeated this randomization procedure 1,000 times to produce a probability distribution for Az, and estimated the Az leading to a significance level of P<0.01.Given the linearity of our model, we also computed scalp topographies of the discriminating components resulting from equation (1) by estimating a forward model as:\n\n\n\nwhere yi(\u03c4) is now shown as a vector y(\u03c4), where each row is from trial i, and xi(\u03c4) is organised as a matrix, x(\u03c4), where rows are channels and columns are trials, all for time window \u03c4.",
    "The non-equal length of systole and diastole meant that we were more likely (\u223c60%) to have an outcome onset in the diastole phases of the cardiac cycle.",
    "The analysis was performed on the CRS-locked EEG data. (b) Discriminator performance (cross-validated Area under the curve, Az) during absolute PE discrimination (low vs. high surprising outcomes), averaged across subjects (N = 32).",
    "The dotted line represents the average Az value leading to a significance level of P = 0.01, estimated using a bootstrap test.",
    "Points are individual subjects. (d) The same analysis as in figure 3b (N = 32) for each CRS after outcome.",
    "The scalp map represents the spatial topography of the absolute PE component. (e) Description of the data used for the signed PE discrimination: we used outcomes defined by the RL model as either positive or negative PEs. (f) Discriminator performance (cross-validated Az) during signed PE discrimination (positive versus negative PE), across all CRS after outcome, averaged across subjects (N = 32).",
    "We then looked at the EEG response locked to the next heart-beat. (b) Mean amplitude difference between the CRS of the first heartbeat after all outcomes presented at systole versus diastole (N=32).",
    "A violin plot is used to present all individual participants\u2019 averages. (c) Mean amplitude difference in the CRS for the low salient outcomes presented at systole versus diastole across subjects (N=32). (d) Mean amplitude difference in CRS for the high salient outcomes presented at systole versus diastole (N=32). (e) Parametric effect of the CRS showing that the lower the absolute PE, the more there is a significant difference between the CRS at diastole and systole. (f) learning rates \u2013 all task blocks (g) learning rates - predictive blocks (h) learning rates - non predictive blocks (i) reward \u2013 all task blocks (j) reward - predictive blocks (k) reward - non predictive blocks. (f-k) In red, the fit of the robust regression.",
    "Supplementary Figure 3.: Control analyses for potential unaccounted effects. (a) The average number of trials for systole and diastole was the same across predictive and non-predictive blocks. (b) Mean absolute PE difference between the CRS for all outcomes presented at systole versus diastole (N=32).",
    "A violin plot is used to present all participants\u2019 average. (c) Mean reward difference between the CRS for all outcomes presented at systole versus diastole (N=32)."
  ],
  "methods_sentences": [
    "There were three predictive schemes with high associations between cues and colours (highly predictive anticorrelated, highly predictive correlated, and variable predictive schemes) and one scheme with no associations between cues and colours (non-predictive scheme) (Fig.1C).biorxiv;2022.07.07.498947v1/FIG1F1fig1Figure 1.Schematic representation of the task and RL results for all four association schemes, highly predictive anticorrelated (HA), highly predictive correlated (HC), variable predictive (VP) and non-predictive (NP). (a) task + cardiac-related neural signals (CRS) recorded at outcome for 4 sec -enough to get on average 3.5 CRSs (b) example of association between cues and predicted colour for one version of the task (anti-correlated blocks \u2013 see Methods) (c) prediction strengths for each block (d) model prediction of choices (e-g) RL parameters (h) definition of absolute and signed PEInitial analyses confirmed that the cue-colour prediction strength (which determined reward contingencies) was the primary modulator of adaptive behaviour in the task (Supplementary Figure 1).",
    "When contrasting trials in the absolute PE domain, we found an increased HEP amplitude on the low surprising trials as opposed to the high surprising trials (Monte-Carlo p values < 0.003); these differences were observed in two clusters with latencies 222 - 252 milliseconds and 418 - 464 milliseconds, both in the centro-parietal sites (Figure 2d).biorxiv;2022.07.07.498947v1/FIG2F2fig2Figure 2.CRS morphology and results. (a) Grand average waveforms across the scalp time-locked to the onset of the R-wave which is the biggest electrical wave generated during normal conduction (time 0 ms, see Methods).",
    "The set of electrodes clustered by ROIs (colour-coded) for the fronto-central and central-parietal electrodes are represented for further analyses (b-d) CRS waveforms across all trials following the onset of the R-wave (at time 0 ms) are shown separately for (b) positive and negative signed PEs for the frontal cluster (c) correct and incorrect feedback for the central cluster (d) high and low surprising outcomes (absolute PEs) for the central cluster.",
    "Sample sizes were determined based on previous studies that have used similar reward learning paradigms to investigate brain responses during learning 28,30,47, and studies that have measured the CRS to investigate neural responses to heartbeats in humans 14, 22.StimuliStimuli consisted of pictures of 10 faces and 10 houses (512 \u00d7 512 pixels) adapted from previous EEG experiments48, two circles in blue and orange (125 \u00d7 125 pixels).",
    "The outcome images consisted of a tick and a cross, which were also equalised for luminance and contrast.Experimental designParticipants were seated in a dimly lit, sound-attenuated, and electrically shielded chamber in front of a monitor at a distance of 70 cm.",
    "On each trial, participants first saw a fixation cross for 500ms, followed by the presentation of one stimulus that could be either a face or a house (500ms).",
    "The decision phase lasted 1200ms.",
    "After participants made their decisions, they saw the outcome of their choice for 4000ms, which allowed us to record on average four heartbeat per outcome (mean: 4.58, std+-0.85 across trials).",
    "The subsequent comparison was based on the sum of these two estimated BIC measures, which penalised the inclusion of additional free parameters.EEG and ECG recordingEEG was recorded with sintered Ag/AgCl electrodes from 62 scalp electrodes mounted equidistantly on an elastic electrode cap (64Ch-Standard-BrainCap for TMS with Multitrodes; EasyCap; two cap sizes, 56 cm and 58 cm head circumference).",
    "The distance between electrodes was on average 3.3cm and 3.5cm for the 56cm and the 58cm cap, respectively.",
    "An additional ECG electrode was placed on the participants\u2019 chests around 12 cm below the left clavicle.",
    "Continuous EEG was recorded using BrainAmp amplifiers (BrainProducts, Munich, Germany; 0.1 \u03bcV analog-to-digital conversion resolution; 1000 Hz sampling rate; 0.01-100 Hz online cut-off filters).EEG data analysisOff-line EEG analysis was performed using Fieldtrip (https://www.fieldtriptoolbox.org/).",
    "The data was digitally band-pass-filtered between 0.5-40 Hz.",
    "The R-peak of the R-wave determines the time 0ms of our CRS.The intervals time-locked to the feedback onset were segmented into 4.9s intervals starting from 0.9s before the feedback onset.",
    "R-peaks were shifted within a time window of \u2212500 to +500 ms and they were shifted by the same amount separately for each subject and each of the four learning blocks.",
    "Locked to the heartbeat, these binary groups included: (1) positive versus negative signed PEs, (2) very high and very low absolute PEs.All analyses were performed on windows with a length of N=60 ms and the window centre \u03c4 was shifted from \u2212100 to 600 ms relative to the heartbeat onset, in 10-ms increments.",
    "We applied a regularised Fisher discriminant analysis to find the spatial weighting, w(\u03c4), that maximally discriminated between the binary groups described above, arriving at a one-dimensional projection yi(\u03c4), for each trial i and a given window \u03c4:\n\n\n\nwhere yi(\u03c4), is organised as a vector of single-trial discriminator amplitudes (1 \u00d7 Trials), the spatial filter, w(\u03c4), is organised as a vector with as many weights as there are channels in the data (1 \u00d7 64) and data, xi(\u03c4), is organised as a matrix, with dimensions (64 \u00d7 Trials/Samples).",
    "We defined systole as the time between the R-peak and 300ms after R-peak (to coincide with the end of T-wave) (figure 3a) 7,56.",
    "Figure 1.: Schematic representation of the task and RL results for all four association schemes, highly predictive anticorrelated (HA), highly predictive correlated (HC), variable predictive (VP) and non-predictive (NP). (a) task + cardiac-related neural signals (CRS) recorded at outcome for 4 sec -enough to get on average 3.5 CRSs (b) example of association between cues and predicted colour for one version of the task (anti-correlated blocks \u2013 see Methods) (c) prediction strengths for each block (d) model prediction of choices (e-g) RL parameters (h) definition of absolute and signed PE\nFigure 2.: CRS morphology and results. (a) Grand average waveforms across the scalp time-locked to the onset of the R-wave which is the biggest electrical wave generated during normal conduction (time 0 ms, see Methods)."
  ],
  "table_count": 0
}

benchmark/test-cases/timing-along-the-cardiac-cycle-modulates-neural-si/experimental_log.md

## Key Results

- ResultsStatistics of the reward environment predict learningParticipants carried out a reward-guided decision task inspired by previous credit assignment tasks 28,29.
- While participants performed the task, we recorded neural responses to heartbeats with EEG and ECG (Fig.1A) during the outcome which included a four-second period to ensure that multiple heart beats would be recorded (mean: 4.58, std+-0.85).
- There were three predictive schemes with high associations between cues and colours (highly predictive anticorrelated, highly predictive correlated, and variable predictive schemes) and one scheme with no associations between cues and colours (non-predictive scheme) (Fig.1C).biorxiv;2022.07.07.49894
- (a) task + cardiac-related neural signals (CRS) recorded at outcome for 4 sec -enough to get on average 3.5 CRSs (b) example of association between cues and predicted colour for one version of the task (anti-correlated blocks – see Methods) (c) prediction strengths for each block (d) model predictio
- A formal model comparison showed that the simpler prediction model, lacking any bias, outperformed the more complex version incorporating cue bias (BIC=362.1738, BIC=377.4045) and suggested that participants did not exhibit a bias towards one or other cue type.
- 1H).Grand average modulation of cardiac-related neural signals in learning-related dimensionsWe next looked for EEG signatures of the heartbeat evoked potential (HEP).
- Figure 2a presents the topographical characteristics of the HEP based on the averaged cardiac-related neural signals (CRSs) recorded during the outcome (see Methods for the construction of the CRS).
- A morphology analysis revealed that the HEP was widely distributed along fronto-central and centro-parietal areas including the following spatial regions (Fronto-central sites: F1, Fz, F2, FC1, FCz, CF2; Centro-parietal sites: C1, Cz, C2, CP1, CPz, CP2 as in Figure 2a).
- This approach has the advantage of looking at two orthogonal RL signals as seen in Figure 1H.
- The results of the cluster-based permutation analysis (see Methods) revealed an increased HEP amplitude for trials with negative signed PE in comparison to positive signed PE (Monte-Carlo p value = 0.004) between 198 and 252 milliseconds in the fronto-central sites (Figure 2b).
- The contrast between correct and incorrect trials revealed an HEP amplitude increase for correct trials (Monte-Carlo p value = 0.005) in the time range between 286 and 348 milliseconds in the centro-parietal sites (Figure 2c).
- When contrasting trials in the absolute PE domain, we found an increased HEP amplitude on the low surprising trials as opposed to the high surprising trials (Monte-Carlo p values < 0.003); these differences were observed in two clusters with latencies 222 - 252 milliseconds and 418 - 464 millisecond
- (a) Grand average waveforms across the scalp time-locked to the onset of the R-wave which is the biggest electrical wave generated during normal conduction (time 0 ms, see Methods).
- The set of electrodes clustered by ROIs (colour-coded) for the fronto-central and central-parietal electrodes are represented for further analyses (b-d) CRS waveforms across all trials following the onset of the R-wave (at time 0 ms) are shown separately for (b) positive and negative signed PEs for 
- The shaded areas represent the time windows during which the analyses were performed and the HEP typically takes place (0.1-0.6s).The CRS is related to trial-by-trial variation in the absolute PE dimension and not signed PERather than inspecting specific electrode averages, we next wanted to search 
- More specifically, for each participant, we used the average of the CRS for each outcome (see Fig.1a) and calculated the linear weights associated with each electrode that maximally separated (1) positive and negative signed PEs and (2) high versus low magnitude of absolute PE (i.e.
- This method has been well established in EEG data analysis 30,31.
- 2) – between very high versus very low absolute PE outcomes.
- This component peaked in the time range 100–300 milliseconds after the R-wave (Fig.
- On the other hand, we did not observe any CRS component discriminating between positive and negative PEs (Fig.3f).
- By contrast, as noted, a grand average response difference was identified in the ERP in fronto-central electrodes (Fig.2b).
- In conjunction, the two results suggest that there is, on average, a difference in cardiac related signals when the valence of the signed PE is positive or negative31 but that trial-by-trial variability in the heart-related CRS does not reliably covary on a trial-by-trial basis with the trial-by-tri
- low absolute PE [0.25 – 0.50]; and high absolute PE [0.5 – 0.75]) which were not originally used to train the classifier (also called the “unseen” data).
- 3c, blue: intermediate categories, grey: categories used for discrimination) confirming the linear relationship between the CRS-absolute PE component and its model-based counterpart (test on the left-out data: t31 =-7.3027; p=3.22e-8) and also the generalisability and robustness of our machine learn
- Applying this method, we showed that only the first CRS after feedback contained information about absolute PE that could be revealed with machine learning techniques, in the range 100–300 milliseconds after heart beat onset (Fig.
- Naturally, as the diastole phase is longer on average than the systole phase, we expect a higher number of outcomes presented during the diastole phase (m=65±5 and 54±5 for diastole and systole, respectively).
- predictive or non-predictive) employed in the task (see Methods; systole F3=0.2, p=0.893; diastole F3=0.2, p=0.896, supplementary Fig.3a) and were associated with similar levels of overall reward received in the task (t31=0.8046, p=0.4272, supplementary Fig.3b), unsigned PEs from the RL model (t31=-
- Additionally, beyond the linear relationship between absolute PE and CRS (fig3c), we found that the effect of the cardiac cycle increased as absolute PEs became smaller (main effect of absolute PE: t252=14.055, p=1.6e-33; heart cycle: t252=-2.154, p=0.0321; see fig4e).
- This effect was mainly driven by the fact that near-threshold absolute PE were more strongly represented at diastole (t31=2.4089, p=0.0221, fig4c).
- Participants with a higher regression coefficient would have a stronger decrease in the CRS for outcomes presented at diastole compared to systole (see figures 4f-k).
- In line with our predictions, we found that participants showing a higher difference in CRS between diastole and systole were the participants that had higher learning rates and better task performance as indexed by the total number of rewards received (learning rates: t30=2.1821, p=0.0371; reward: 
- The relationship was only present in the blocks in which learning was possible (predictive blocks: learning rates: t30=2.4468, p=0.0205; reward: t30=2.3751, p=0.0241 Fig.4g and 4j; non-predictive blocks: learning rates: t30=-0.4445, p=0.6598; reward: t30=1.1354, p=0.2652 Fig.4h and 4k).
- These results remain true even when including a covariate indexing features of the external outcome type – reward and absolute PE from the model as opposed to the internal, subjective, absolute prediction error (see supplementary figure 4).